root@web-deployment-547bf749b7-m6dt7:/# tcpdump -nn -i any -e port 80
tcpdump: data link type LINUX_SLL2
tcpdump: verbose output suppressed, use -v[v]... for full protocol decode
listening on any, link-type LINUX_SLL2 (Linux cooked v2), snapshot length 262144 bytes
06:03:28.127590 eth0  In  ifindex 3 5e:bd:24:92:01:4b ethertype IPv4 (0x0800), length 80: 10.244.0.96.44904 > 10.244.0.98.80: Flags [S], seq 1625233847, win 64240, options [mss 1460,sackOK,TS val 4020374654 ecr 0,nop,wscale 7], length 0
06:03:28.127596 eth0  Out ifindex 3 ee:4c:a8:85:69:d5 ethertype IPv4 (0x0800), length 80: 10.244.0.98.80 > 10.244.0.96.44904: Flags [S.], seq 3890063775, ack 1625233848, win 65160, options [mss 1460,sackOK,TS val 3771498294 ecr 4020374654,nop,wscale 7], length 0
06:03:28.127604 eth0  In  ifindex 3 5e:bd:24:92:01:4b ethertype IPv4 (0x0800), length 72: 10.244.0.96.44904 > 10.244.0.98.80: Flags [.], ack 1, win 502, options [nop,nop,TS val 4020374654 ecr 3771498294], length 0
06:03:28.127633 eth0  In  ifindex 3 5e:bd:24:92:01:4b ethertype IPv4 (0x0800), length 807: 10.244.0.96.44904 > 10.244.0.98.80: Flags [P.], seq 1:736, ack 1, win 502, options [nop,nop,TS val 4020374654 ecr 3771498294], length 735: HTTP: GET / HTTP/1.1
06:03:28.127634 eth0  Out ifindex 3 ee:4c:a8:85:69:d5 ethertype IPv4 (0x0800), length 72: 10.244.0.98.80 > 10.244.0.96.44904: Flags [.], ack 736, win 504, options [nop,nop,TS val 3771498294 ecr 4020374654], length 0
06:03:28.127713 eth0  Out ifindex 3 ee:4c:a8:85:69:d5 ethertype IPv4 (0x0800), length 255: 10.244.0.98.80 > 10.244.0.96.44904: Flags [P.], seq 1:184, ack 736, win 504, options [nop,nop,TS val 3771498294 ecr 4020374654], length 183: HTTP: HTTP/1.1 304 Not Modified
06:03:28.127732 eth0  In  ifindex 3 5e:bd:24:92:01:4b ethertype IPv4 (0x0800), length 72: 10.244.0.96.44904 > 10.244.0.98.80: Flags [.], ack 184, win 501, options [nop,nop,TS val 4020374654 ecr 3771498294], length 0
06:03:28.138650 eth0  In  ifindex 3 5e:bd:24:92:01:4b ethertype IPv4 (0x0800), length 736: 10.244.0.96.44904 > 10.244.0.98.80: Flags [P.], seq 736:1400, ack 184, win 501, options [nop,nop,TS val 4020374665 ecr 3771498294], length 664: HTTP: GET /_next/static/images/img/logo2022_without_text-ad6a01e8608432b9967c441a0f4760b4.svg HTTP/1.1
06:03:28.138759 eth0  Out ifindex 3 ee:4c:a8:85:69:d5 ethertype IPv4 (0x0800), length 782: 10.244.0.98.80 > 10.244.0.96.44904: Flags [P.], seq 184:894, ack 1400, win 501, options [nop,nop,TS val 3771498305 ecr 4020374665], length 710: HTTP: HTTP/1.1 404 Not Found
06:03:28.138803 eth0  In  ifindex 3 5e:bd:24:92:01:4b ethertype IPv4 (0x0800), length 80: 10.244.0.96.44918 > 10.244.0.98.80: Flags [S], seq 2889233270, win 64240, options [mss 1460,sackOK,TS val 4020374665 ecr 0,nop,wscale 7], length 0
06:03:28.138811 eth0  Out ifindex 3 ee:4c:a8:85:69:d5 ethertype IPv4 (0x0800), length 80: 10.244.0.98.80 > 10.244.0.96.44918: Flags [S.], seq 3066216216, ack 2889233271, win 65160, options [mss 1460,sackOK,TS val 3771498305 ecr 4020374665,nop,wscale 7], length 0
06:03:28.138819 eth0  In  ifindex 3 5e:bd:24:92:01:4b ethertype IPv4 (0x0800), length 72: 10.244.0.96.44918 > 10.244.0.98.80: Flags [.], ack 1, win 502, options [nop,nop,TS val 4020374665 ecr 3771498305], length 0
06:03:28.138853 eth0  In  ifindex 3 5e:bd:24:92:01:4b ethertype IPv4 (0x0800), length 720: 10.244.0.96.44918 > 10.244.0.98.80: Flags [P.], seq 1:649, ack 1, win 502, options [nop,nop,TS val 4020374665 ecr 3771498305], length 648: HTTP: GET /_next/static/images/img/light-3dd56d782c43dc1e78b7e0da7bb3fb50.svg HTTP/1.1
06:03:28.138855 eth0  Out ifindex 3 ee:4c:a8:85:69:d5 ethertype IPv4 (0x0800), length 72: 10.244.0.98.80 > 10.244.0.96.44918: Flags [.], ack 649, win 504, options [nop,nop,TS val 3771498305 ecr 4020374665], length 0
06:03:28.140327 eth0  Out ifindex 3 ee:4c:a8:85:69:d5 ethertype IPv4 (0x0800), length 782: 10.244.0.98.80 > 10.244.0.96.44918: Flags [P.], seq 1:711, ack 649, win 504, options [nop,nop,TS val 3771498306 ecr 4020374665], length 710: HTTP: HTTP/1.1 404 Not Found
06:03:28.141982 eth0  In  ifindex 3 5e:bd:24:92:01:4b ethertype IPv4 (0x0800), length 72: 10.244.0.96.44918 > 10.244.0.98.80: Flags [.], ack 711, win 501, options [nop,nop,TS val 4020374666 ecr 3771498306], length 0
06:03:28.143179 eth0  In  ifindex 3 5e:bd:24:92:01:4b ethertype IPv4 (0x0800), length 80: 10.244.0.96.44920 > 10.244.0.98.80: Flags [S], seq 1604645625, win 64240, options [mss 1460,sackOK,TS val 4020374669 ecr 0,nop,wscale 7], length 0
06:03:28.143185 eth0  Out ifindex 3 ee:4c:a8:85:69:d5 ethertype IPv4 (0x0800), length 80: 10.244.0.98.80 > 10.244.0.96.44920: Flags [S.], seq 4281508539, ack 1604645626, win 65160, options [mss 1460,sackOK,TS val 3771498309 ecr 4020374669,nop,wscale 7], length 0
06:03:28.143202 eth0  In  ifindex 3 5e:bd:24:92:01:4b ethertype IPv4 (0x0800), length 72: 10.244.0.96.44920 > 10.244.0.98.80: Flags [.], ack 1, win 502, options [nop,nop,TS val 4020374669 ecr 3771498309], length 0
06:03:28.143215 eth0  In  ifindex 3 5e:bd:24:92:01:4b ethertype IPv4 (0x0800), length 645: 10.244.0.96.44920 > 10.244.0.98.80: Flags [P.], seq 1:574, ack 1, win 502, options [nop,nop,TS val 4020374669 ecr 3771498309], length 573: HTTP: GET /_next/static/css/836291761b47c01f.css HTTP/1.1
06:03:28.143216 eth0  Out ifindex 3 ee:4c:a8:85:69:d5 ethertype IPv4 (0x0800), length 72: 10.244.0.98.80 > 10.244.0.96.44920: Flags [.], ack 574, win 505, options [nop,nop,TS val 3771498309 ecr 4020374669], length 0
06:03:28.145595 eth0  Out ifindex 3 ee:4c:a8:85:69:d5 ethertype IPv4 (0x0800), length 782: 10.244.0.98.80 > 10.244.0.96.44920: Flags [P.], seq 1:711, ack 574, win 505, options [nop,nop,TS val 3771498312 ecr 4020374669], length 710: HTTP: HTTP/1.1 404 Not Found
06:03:28.145608 eth0  In  ifindex 3 5e:bd:24:92:01:4b ethertype IPv4 (0x0800), length 72: 10.244.0.96.44920 > 10.244.0.98.80: Flags [.], ack 711, win 501, options [nop,nop,TS val 4020374672 ecr 3771498312], length 0
06:03:28.150344 eth0  In  ifindex 3 5e:bd:24:92:01:4b ethertype IPv4 (0x0800), length 645: 10.244.0.96.44904 > 10.244.0.98.80: Flags [P.], seq 1400:1973, ack 894, win 501, options [nop,nop,TS val 4020374676 ecr 3771498305], length 573: HTTP: GET /_next/static/css/678db5fa78df04a6.css HTTP/1.1
06:03:28.150534 eth0  Out ifindex 3 ee:4c:a8:85:69:d5 ethertype IPv4 (0x0800), length 782: 10.244.0.98.80 > 10.244.0.96.44904: Flags [P.], seq 894:1604, ack 1973, win 501, options [nop,nop,TS val 3771498317 ecr 4020374676], length 710: HTTP: HTTP/1.1 404 Not Found
06:03:28.150680 eth0  In  ifindex 3 5e:bd:24:92:01:4b ethertype IPv4 (0x0800), length 655: 10.244.0.96.44920 > 10.244.0.98.80: Flags [P.], seq 574:1157, ack 711, win 501, options [nop,nop,TS val 4020374677 ecr 3771498312], length 583: HTTP: GET /cdn-cgi/scripts/5c5dd728/cloudflare-static/email-decode.min.js HTTP/1.1
06:03:28.150745 eth0  Out ifindex 3 ee:4c:a8:85:69:d5 ethertype IPv4 (0x0800), length 782: 10.244.0.98.80 > 10.244.0.96.44920: Flags [P.], seq 711:1421, ack 1157, win 501, options [nop,nop,TS val 3771498317 ecr 4020374677], length 710: HTTP: HTTP/1.1 404 Not Found
06:03:28.192180 eth0  In  ifindex 3 5e:bd:24:92:01:4b ethertype IPv4 (0x0800), length 72: 10.244.0.96.44920 > 10.244.0.98.80: Flags [.], ack 1421, win 501, options [nop,nop,TS val 4020374718 ecr 3771498317], length 0
06:03:28.192180 eth0  In  ifindex 3 5e:bd:24:92:01:4b ethertype IPv4 (0x0800), length 72: 10.244.0.96.44904 > 10.244.0.98.80: Flags [.], ack 1604, win 501, options [nop,nop,TS val 4020374718 ecr 3771498317], length 0
06:03:28.208899 eth0  In  ifindex 3 5e:bd:24:92:01:4b ethertype IPv4 (0x0800), length 640: 10.244.0.96.44920 > 10.244.0.98.80: Flags [P.], seq 1157:1725, ack 1421, win 501, options [nop,nop,TS val 4020374735 ecr 3771498317], length 568: HTTP: GET /_next/static/chunks/webpack-b3e62039401890d6.js HTTP/1.1
06:03:28.209640 eth0  In  ifindex 3 5e:bd:24:92:01:4b ethertype IPv4 (0x0800), length 641: 10.244.0.96.44904 > 10.244.0.98.80: Flags [P.], seq 1973:2542, ack 1604, win 501, options [nop,nop,TS val 4020374736 ecr 3771498317], length 569: HTTP: GET /_next/static/chunks/b6261da7-c0c16addc123a5d7.js HTTP/1.1
06:03:28.210108 eth0  In  ifindex 3 5e:bd:24:92:01:4b ethertype IPv4 (0x0800), length 80: 10.244.0.96.44924 > 10.244.0.98.80: Flags [S], seq 4093120845, win 64240, options [mss 1460,sackOK,TS val 4020374736 ecr 0,nop,wscale 7], length 0
06:03:28.210114 eth0  Out ifindex 3 ee:4c:a8:85:69:d5 ethertype IPv4 (0x0800), length 80: 10.244.0.98.80 > 10.244.0.96.44924: Flags [S.], seq 3098391884, ack 4093120846, win 65160, options [mss 1460,sackOK,TS val 3771498376 ecr 4020374736,nop,wscale 7], length 0
06:03:28.210123 eth0  In  ifindex 3 5e:bd:24:92:01:4b ethertype IPv4 (0x0800), length 72: 10.244.0.96.44924 > 10.244.0.98.80: Flags [.], ack 1, win 502, options [nop,nop,TS val 4020374736 ecr 3771498376], length 0
06:03:28.210133 eth0  In  ifindex 3 5e:bd:24:92:01:4b ethertype IPv4 (0x0800), length 637: 10.244.0.96.44924 > 10.244.0.98.80: Flags [P.], seq 1:566, ack 1, win 502, options [nop,nop,TS val 4020374736 ecr 3771498376], length 565: HTTP: GET /_next/static/chunks/2342-ac345ce3c4e90d77.js HTTP/1.1
06:03:28.210134 eth0  Out ifindex 3 ee:4c:a8:85:69:d5 ethertype IPv4 (0x0800), length 72: 10.244.0.98.80 > 10.244.0.96.44924: Flags [.], ack 566, win 505, options [nop,nop,TS val 3771498376 ecr 4020374736], length 0
06:03:28.211561 eth0  In  ifindex 3 5e:bd:24:92:01:4b ethertype IPv4 (0x0800), length 641: 10.244.0.96.44918 > 10.244.0.98.80: Flags [P.], seq 649:1218, ack 711, win 501, options [nop,nop,TS val 4020374738 ecr 3771498306], length 569: HTTP: GET /_next/static/chunks/main-app-b3f4eb23c41731f3.js HTTP/1.1
06:03:28.211646 eth0  In  ifindex 3 5e:bd:24:92:01:4b ethertype IPv4 (0x0800), length 80: 10.244.0.96.44936 > 10.244.0.98.80: Flags [S], seq 2308203256, win 64240, options [mss 1460,sackOK,TS val 4020374738 ecr 0,nop,wscale 7], length 0
06:03:28.211650 eth0  Out ifindex 3 ee:4c:a8:85:69:d5 ethertype IPv4 (0x0800), length 80: 10.244.0.98.80 > 10.244.0.96.44936: Flags [S.], seq 2978093866, ack 2308203257, win 65160, options [mss 1460,sackOK,TS val 3771498378 ecr 4020374738,nop,wscale 7], length 0
06:03:28.211656 eth0  In  ifindex 3 5e:bd:24:92:01:4b ethertype IPv4 (0x0800), length 72: 10.244.0.96.44936 > 10.244.0.98.80: Flags [.], ack 1, win 502, options [nop,nop,TS val 4020374738 ecr 3771498378], length 0
06:03:28.211665 eth0  In  ifindex 3 5e:bd:24:92:01:4b ethertype IPv4 (0x0800), length 641: 10.244.0.96.44936 > 10.244.0.98.80: Flags [P.], seq 1:570, ack 1, win 502, options [nop,nop,TS val 4020374738 ecr 3771498378], length 569: HTTP: GET /_next/static/chunks/b57a0ff0-fe03367d885866fa.js HTTP/1.1
06:03:28.211666 eth0  Out ifindex 3 ee:4c:a8:85:69:d5 ethertype IPv4 (0x0800), length 72: 10.244.0.98.80 > 10.244.0.96.44936: Flags [.], ack 570, win 505, options [nop,nop,TS val 3771498378 ecr 4020374738], length 0
06:03:28.212221 eth0  In  ifindex 3 5e:bd:24:92:01:4b ethertype IPv4 (0x0800), length 80: 10.244.0.96.44950 > 10.244.0.98.80: Flags [S], seq 571208346, win 64240, options [mss 1460,sackOK,TS val 4020374738 ecr 0,nop,wscale 7], length 0
06:03:28.212225 eth0  Out ifindex 3 ee:4c:a8:85:69:d5 ethertype IPv4 (0x0800), length 80: 10.244.0.98.80 > 10.244.0.96.44950: Flags [S.], seq 2207918637, ack 571208347, win 65160, options [mss 1460,sackOK,TS val 3771498378 ecr 4020374738,nop,wscale 7], length 0
06:03:28.212232 eth0  In  ifindex 3 5e:bd:24:92:01:4b ethertype IPv4 (0x0800), length 72: 10.244.0.96.44950 > 10.244.0.98.80: Flags [.], ack 1, win 502, options [nop,nop,TS val 4020374738 ecr 3771498378], length 0
06:03:28.212245 eth0  In  ifindex 3 5e:bd:24:92:01:4b ethertype IPv4 (0x0800), length 637: 10.244.0.96.44950 > 10.244.0.98.80: Flags [P.], seq 1:566, ack 1, win 502, options [nop,nop,TS val 4020374738 ecr 3771498378], length 565: HTTP: GET /_next/static/chunks/6278-9feff475b7288171.js HTTP/1.1
06:03:28.212246 eth0  Out ifindex 3 ee:4c:a8:85:69:d5 ethertype IPv4 (0x0800), length 72: 10.244.0.98.80 > 10.244.0.96.44950: Flags [.], ack 566, win 505, options [nop,nop,TS val 3771498378 ecr 4020374738], length 0
06:03:28.212537 eth0  Out ifindex 3 ee:4c:a8:85:69:d5 ethertype IPv4 (0x0800), length 782: 10.244.0.98.80 > 10.244.0.96.44920: Flags [P.], seq 1421:2131, ack 1725, win 501, options [nop,nop,TS val 3771498379 ecr 4020374735], length 710: HTTP: HTTP/1.1 404 Not Found
06:03:28.213165 eth0  In  ifindex 3 5e:bd:24:92:01:4b ethertype IPv4 (0x0800), length 72: 10.244.0.96.44920 > 10.244.0.98.80: Flags [.], ack 2131, win 501, options [nop,nop,TS val 4020374739 ecr 3771498379], length 0
06:03:28.213215 eth0  Out ifindex 3 ee:4c:a8:85:69:d5 ethertype IPv4 (0x0800), length 782: 10.244.0.98.80 > 10.244.0.96.44904: Flags [P.], seq 1604:2314, ack 2542, win 501, options [nop,nop,TS val 3771498379 ecr 4020374736], length 710: HTTP: HTTP/1.1 404 Not Found
06:03:28.214526 eth0  In  ifindex 3 5e:bd:24:92:01:4b ethertype IPv4 (0x0800), length 72: 10.244.0.96.44904 > 10.244.0.98.80: Flags [.], ack 2314, win 501, options [nop,nop,TS val 4020374739 ecr 3771498379], length 0
06:03:28.214562 eth0  Out ifindex 3 ee:4c:a8:85:69:d5 ethertype IPv4 (0x0800), length 782: 10.244.0.98.80 > 10.244.0.96.44918: Flags [P.], seq 711:1421, ack 1218, win 501, options [nop,nop,TS val 3771498381 ecr 4020374738], length 710: HTTP: HTTP/1.1 404 Not Found
06:03:28.214571 eth0  In  ifindex 3 5e:bd:24:92:01:4b ethertype IPv4 (0x0800), length 72: 10.244.0.96.44918 > 10.244.0.98.80: Flags [.], ack 1421, win 501, options [nop,nop,TS val 4020374741 ecr 3771498381], length 0
06:03:28.215315 eth0  Out ifindex 3 ee:4c:a8:85:69:d5 ethertype IPv4 (0x0800), length 782: 10.244.0.98.80 > 10.244.0.96.44924: Flags [P.], seq 1:711, ack 566, win 505, options [nop,nop,TS val 3771498381 ecr 4020374736], length 710: HTTP: HTTP/1.1 404 Not Found
06:03:28.217091 eth0  In  ifindex 3 5e:bd:24:92:01:4b ethertype IPv4 (0x0800), length 72: 10.244.0.96.44924 > 10.244.0.98.80: Flags [.], ack 711, win 501, options [nop,nop,TS val 4020374741 ecr 3771498381], length 0
06:03:28.218695 eth0  Out ifindex 3 ee:4c:a8:85:69:d5 ethertype IPv4 (0x0800), length 782: 10.244.0.98.80 > 10.244.0.96.44936: Flags [P.], seq 1:711, ack 570, win 505, options [nop,nop,TS val 3771498385 ecr 4020374738], length 710: HTTP: HTTP/1.1 404 Not Found
06:03:28.218707 eth0  In  ifindex 3 5e:bd:24:92:01:4b ethertype IPv4 (0x0800), length 72: 10.244.0.96.44936 > 10.244.0.98.80: Flags [.], ack 711, win 501, options [nop,nop,TS val 4020374745 ecr 3771498385], length 0
06:03:28.219176 eth0  In  ifindex 3 5e:bd:24:92:01:4b ethertype IPv4 (0x0800), length 637: 10.244.0.96.44924 > 10.244.0.98.80: Flags [P.], seq 566:1131, ack 711, win 501, options [nop,nop,TS val 4020374745 ecr 3771498381], length 565: HTTP: GET /_next/static/chunks/3226-3f9238ed4f7da5a9.js HTTP/1.1
06:03:28.219641 eth0  In  ifindex 3 5e:bd:24:92:01:4b ethertype IPv4 (0x0800), length 637: 10.244.0.96.44936 > 10.244.0.98.80: Flags [P.], seq 570:1135, ack 711, win 501, options [nop,nop,TS val 4020374746 ecr 3771498385], length 565: HTTP: GET /_next/static/chunks/4860-d1cabd9437f1616a.js HTTP/1.1
06:03:28.221422 eth0  Out ifindex 3 ee:4c:a8:85:69:d5 ethertype IPv4 (0x0800), length 782: 10.244.0.98.80 > 10.244.0.96.44950: Flags [P.], seq 1:711, ack 566, win 505, options [nop,nop,TS val 3771498388 ecr 4020374738], length 710: HTTP: HTTP/1.1 404 Not Found
06:03:28.221481 eth0  In  ifindex 3 5e:bd:24:92:01:4b ethertype IPv4 (0x0800), length 72: 10.244.0.96.44950 > 10.244.0.98.80: Flags [.], ack 711, win 501, options [nop,nop,TS val 4020374748 ecr 3771498388], length 0
06:03:28.221501 eth0  Out ifindex 3 ee:4c:a8:85:69:d5 ethertype IPv4 (0x0800), length 782: 10.244.0.98.80 > 10.244.0.96.44924: Flags [P.], seq 711:1421, ack 1131, win 501, options [nop,nop,TS val 3771498388 ecr 4020374745], length 710: HTTP: HTTP/1.1 404 Not Found
06:03:28.221521 eth0  Out ifindex 3 ee:4c:a8:85:69:d5 ethertype IPv4 (0x0800), length 782: 10.244.0.98.80 > 10.244.0.96.44936: Flags [P.], seq 711:1421, ack 1135, win 501, options [nop,nop,TS val 3771498388 ecr 4020374746], length 710: HTTP: HTTP/1.1 404 Not Found
06:03:28.221607 eth0  In  ifindex 3 5e:bd:24:92:01:4b ethertype IPv4 (0x0800), length 637: 10.244.0.96.44904 > 10.244.0.98.80: Flags [P.], seq 2542:3107, ack 2314, win 501, options [nop,nop,TS val 4020374748 ecr 3771498379], length 565: HTTP: GET /_next/static/chunks/5890-3e025b19d2ac88cc.js HTTP/1.1
06:03:28.221645 eth0  In  ifindex 3 5e:bd:24:92:01:4b ethertype IPv4 (0x0800), length 637: 10.244.0.96.44936 > 10.244.0.98.80: Flags [P.], seq 1135:1700, ack 1421, win 501, options [nop,nop,TS val 4020374748 ecr 3771498388], length 565: HTTP: GET /_next/static/chunks/8740-7ab0c22a2ecc60a0.js HTTP/1.1
06:03:28.221684 eth0  In  ifindex 3 5e:bd:24:92:01:4b ethertype IPv4 (0x0800), length 637: 10.244.0.96.44924 > 10.244.0.98.80: Flags [P.], seq 1131:1696, ack 1421, win 501, options [nop,nop,TS val 4020374748 ecr 3771498388], length 565: HTTP: GET /_next/static/chunks/3701-5f0c417f407b65b3.js HTTP/1.1
06:03:28.221862 eth0  Out ifindex 3 ee:4c:a8:85:69:d5 ethertype IPv4 (0x0800), length 782: 10.244.0.98.80 > 10.244.0.96.44904: Flags [P.], seq 2314:3024, ack 3107, win 501, options [nop,nop,TS val 3771498388 ecr 4020374748], length 710: HTTP: HTTP/1.1 404 Not Found
06:03:28.221961 eth0  Out ifindex 3 ee:4c:a8:85:69:d5 ethertype IPv4 (0x0800), length 782: 10.244.0.98.80 > 10.244.0.96.44936: Flags [P.], seq 1421:2131, ack 1700, win 501, options [nop,nop,TS val 3771498388 ecr 4020374748], length 710: HTTP: HTTP/1.1 404 Not Found
06:03:28.222002 eth0  Out ifindex 3 ee:4c:a8:85:69:d5 ethertype IPv4 (0x0800), length 782: 10.244.0.98.80 > 10.244.0.96.44924: Flags [P.], seq 1421:2131, ack 1696, win 501, options [nop,nop,TS val 3771498388 ecr 4020374748], length 710: HTTP: HTTP/1.1 404 Not Found
06:03:28.225029 eth0  In  ifindex 3 5e:bd:24:92:01:4b ethertype IPv4 (0x0800), length 637: 10.244.0.96.44936 > 10.244.0.98.80: Flags [P.], seq 1700:2265, ack 2131, win 501, options [nop,nop,TS val 4020374751 ecr 3771498388], length 565: HTTP: GET /_next/static/chunks/9819-e8dc6e248bfef4ed.js HTTP/1.1
06:03:28.225094 eth0  Out ifindex 3 ee:4c:a8:85:69:d5 ethertype IPv4 (0x0800), length 782: 10.244.0.98.80 > 10.244.0.96.44936: Flags [P.], seq 2131:2841, ack 2265, win 501, options [nop,nop,TS val 3771498391 ecr 4020374751], length 710: HTTP: HTTP/1.1 404 Not Found
06:03:28.225116 eth0  In  ifindex 3 5e:bd:24:92:01:4b ethertype IPv4 (0x0800), length 636: 10.244.0.96.44918 > 10.244.0.98.80: Flags [P.], seq 1218:1782, ack 1421, win 501, options [nop,nop,TS val 4020374751 ecr 3771498381], length 564: HTTP: GET /_next/static/chunks/723-4f601221cfe1abde.js HTTP/1.1
06:03:28.225138 eth0  In  ifindex 3 5e:bd:24:92:01:4b ethertype IPv4 (0x0800), length 637: 10.244.0.96.44924 > 10.244.0.98.80: Flags [P.], seq 1696:2261, ack 2131, win 501, options [nop,nop,TS val 4020374751 ecr 3771498388], length 565: HTTP: GET /_next/static/chunks/2488-c476e71f34b39006.js HTTP/1.1
06:03:28.225179 eth0  Out ifindex 3 ee:4c:a8:85:69:d5 ethertype IPv4 (0x0800), length 782: 10.244.0.98.80 > 10.244.0.96.44918: Flags [P.], seq 1421:2131, ack 1782, win 501, options [nop,nop,TS val 3771498391 ecr 4020374751], length 710: HTTP: HTTP/1.1 404 Not Found
06:03:28.225201 eth0  Out ifindex 3 ee:4c:a8:85:69:d5 ethertype IPv4 (0x0800), length 782: 10.244.0.98.80 > 10.244.0.96.44924: Flags [P.], seq 2131:2841, ack 2261, win 501, options [nop,nop,TS val 3771498391 ecr 4020374751], length 710: HTTP: HTTP/1.1 404 Not Found
06:03:28.232133 eth0  In  ifindex 3 5e:bd:24:92:01:4b ethertype IPv4 (0x0800), length 637: 10.244.0.96.44950 > 10.244.0.98.80: Flags [P.], seq 566:1131, ack 711, win 501, options [nop,nop,TS val 4020374758 ecr 3771498388], length 565: HTTP: GET /_next/static/chunks/8989-2af2f40ee7c88631.js HTTP/1.1
06:03:28.232133 eth0  In  ifindex 3 5e:bd:24:92:01:4b ethertype IPv4 (0x0800), length 637: 10.244.0.96.44918 > 10.244.0.98.80: Flags [P.], seq 1782:2347, ack 2131, win 501, options [nop,nop,TS val 4020374758 ecr 3771498391], length 565: HTTP: GET /_next/static/chunks/4592-c799fc9a8b37fe0f.js HTTP/1.1
06:03:28.232138 eth0  In  ifindex 3 5e:bd:24:92:01:4b ethertype IPv4 (0x0800), length 637: 10.244.0.96.44904 > 10.244.0.98.80: Flags [P.], seq 3107:3672, ack 3024, win 501, options [nop,nop,TS val 4020374758 ecr 3771498388], length 565: HTTP: GET /_next/static/chunks/9908-889a180046460a0e.js HTTP/1.1
06:03:28.232143 eth0  In  ifindex 3 5e:bd:24:92:01:4b ethertype IPv4 (0x0800), length 637: 10.244.0.96.44924 > 10.244.0.98.80: Flags [P.], seq 2261:2826, ack 2841, win 501, options [nop,nop,TS val 4020374758 ecr 3771498391], length 565: HTTP: GET /_next/static/chunks/1667-0e3629103b74bace.js HTTP/1.1
06:03:28.232189 eth0  In  ifindex 3 5e:bd:24:92:01:4b ethertype IPv4 (0x0800), length 637: 10.244.0.96.44920 > 10.244.0.98.80: Flags [P.], seq 1725:2290, ack 2131, win 501, options [nop,nop,TS val 4020374758 ecr 3771498379], length 565: HTTP: GET /_next/static/chunks/7591-286de77a78f716c0.js HTTP/1.1
06:03:28.232191 eth0  In  ifindex 3 5e:bd:24:92:01:4b ethertype IPv4 (0x0800), length 637: 10.244.0.96.44936 > 10.244.0.98.80: Flags [P.], seq 2265:2830, ack 2841, win 501, options [nop,nop,TS val 4020374758 ecr 3771498391], length 565: HTTP: GET /_next/static/chunks/3476-4ac688c35c6f8929.js HTTP/1.1
06:03:28.232244 eth0  Out ifindex 3 ee:4c:a8:85:69:d5 ethertype IPv4 (0x0800), length 782: 10.244.0.98.80 > 10.244.0.96.44918: Flags [P.], seq 2131:2841, ack 2347, win 501, options [nop,nop,TS val 3771498398 ecr 4020374758], length 710: HTTP: HTTP/1.1 404 Not Found
06:03:28.232291 eth0  Out ifindex 3 ee:4c:a8:85:69:d5 ethertype IPv4 (0x0800), length 782: 10.244.0.98.80 > 10.244.0.96.44950: Flags [P.], seq 711:1421, ack 1131, win 501, options [nop,nop,TS val 3771498398 ecr 4020374758], length 710: HTTP: HTTP/1.1 404 Not Found
06:03:28.232320 eth0  Out ifindex 3 ee:4c:a8:85:69:d5 ethertype IPv4 (0x0800), length 782: 10.244.0.98.80 > 10.244.0.96.44904: Flags [P.], seq 3024:3734, ack 3672, win 501, options [nop,nop,TS val 3771498398 ecr 4020374758], length 710: HTTP: HTTP/1.1 404 Not Found
06:03:28.232487 eth0  Out ifindex 3 ee:4c:a8:85:69:d5 ethertype IPv4 (0x0800), length 782: 10.244.0.98.80 > 10.244.0.96.44924: Flags [P.], seq 2841:3551, ack 2826, win 501, options [nop,nop,TS val 3771498399 ecr 4020374758], length 710: HTTP: HTTP/1.1 404 Not Found
06:03:28.232626 eth0  Out ifindex 3 ee:4c:a8:85:69:d5 ethertype IPv4 (0x0800), length 782: 10.244.0.98.80 > 10.244.0.96.44920: Flags [P.], seq 2131:2841, ack 2290, win 501, options [nop,nop,TS val 3771498399 ecr 4020374758], length 710: HTTP: HTTP/1.1 404 Not Found
06:03:28.232665 eth0  Out ifindex 3 ee:4c:a8:85:69:d5 ethertype IPv4 (0x0800), length 782: 10.244.0.98.80 > 10.244.0.96.44936: Flags [P.], seq 2841:3551, ack 2830, win 501, options [nop,nop,TS val 3771498399 ecr 4020374758], length 710: HTTP: HTTP/1.1 404 Not Found
06:03:28.234550 eth0  In  ifindex 3 5e:bd:24:92:01:4b ethertype IPv4 (0x0800), length 637: 10.244.0.96.44936 > 10.244.0.98.80: Flags [P.], seq 2830:3395, ack 3551, win 501, options [nop,nop,TS val 4020374761 ecr 3771498399], length 565: HTTP: GET /_next/static/chunks/4480-fe808d8ddf3717c0.js HTTP/1.1
06:03:28.234613 eth0  Out ifindex 3 ee:4c:a8:85:69:d5 ethertype IPv4 (0x0800), length 782: 10.244.0.98.80 > 10.244.0.96.44936: Flags [P.], seq 3551:4261, ack 3395, win 501, options [nop,nop,TS val 3771498401 ecr 4020374761], length 710: HTTP: HTTP/1.1 404 Not Found
06:03:28.237426 eth0  In  ifindex 3 5e:bd:24:92:01:4b ethertype IPv4 (0x0800), length 637: 10.244.0.96.44920 > 10.244.0.98.80: Flags [P.], seq 2290:2855, ack 2841, win 501, options [nop,nop,TS val 4020374764 ecr 3771498399], length 565: HTTP: GET /_next/static/chunks/4822-87ec80ad7f25b070.js HTTP/1.1
06:03:28.237487 eth0  In  ifindex 3 5e:bd:24:92:01:4b ethertype IPv4 (0x0800), length 637: 10.244.0.96.44924 > 10.244.0.98.80: Flags [P.], seq 2826:3391, ack 3551, win 501, options [nop,nop,TS val 4020374764 ecr 3771498399], length 565: HTTP: GET /_next/static/chunks/6397-6ee8b63ed3ced817.js HTTP/1.1
06:03:28.239554 eth0  Out ifindex 3 ee:4c:a8:85:69:d5 ethertype IPv4 (0x0800), length 782: 10.244.0.98.80 > 10.244.0.96.44920: Flags [P.], seq 2841:3551, ack 2855, win 501, options [nop,nop,TS val 3771498405 ecr 4020374764], length 710: HTTP: HTTP/1.1 404 Not Found
06:03:28.239615 eth0  Out ifindex 3 ee:4c:a8:85:69:d5 ethertype IPv4 (0x0800), length 782: 10.244.0.98.80 > 10.244.0.96.44924: Flags [P.], seq 3551:4261, ack 3391, win 501, options [nop,nop,TS val 3771498406 ecr 4020374764], length 710: HTTP: HTTP/1.1 404 Not Found
06:03:28.239692 eth0  In  ifindex 3 5e:bd:24:92:01:4b ethertype IPv4 (0x0800), length 637: 10.244.0.96.44904 > 10.244.0.98.80: Flags [P.], seq 3672:4237, ack 3734, win 501, options [nop,nop,TS val 4020374766 ecr 3771498398], length 565: HTTP: GET /_next/static/chunks/9778-64daee7258ce066d.js HTTP/1.1
06:03:28.239729 eth0  In  ifindex 3 5e:bd:24:92:01:4b ethertype IPv4 (0x0800), length 637: 10.244.0.96.44950 > 10.244.0.98.80: Flags [P.], seq 1131:1696, ack 1421, win 501, options [nop,nop,TS val 4020374766 ecr 3771498398], length 565: HTTP: GET /_next/static/chunks/4697-b3a739f947cb7256.js HTTP/1.1
06:03:28.239731 eth0  In  ifindex 3 5e:bd:24:92:01:4b ethertype IPv4 (0x0800), length 637: 10.244.0.96.44936 > 10.244.0.98.80: Flags [P.], seq 3395:3960, ack 4261, win 501, options [nop,nop,TS val 4020374766 ecr 3771498401], length 565: HTTP: GET /_next/static/chunks/1292-9e326bd19ba70812.js HTTP/1.1
06:03:28.239758 eth0  Out ifindex 3 ee:4c:a8:85:69:d5 ethertype IPv4 (0x0800), length 782: 10.244.0.98.80 > 10.244.0.96.44904: Flags [P.], seq 3734:4444, ack 4237, win 501, options [nop,nop,TS val 3771498406 ecr 4020374766], length 710: HTTP: HTTP/1.1 404 Not Found
06:03:28.239800 eth0  Out ifindex 3 ee:4c:a8:85:69:d5 ethertype IPv4 (0x0800), length 782: 10.244.0.98.80 > 10.244.0.96.44950: Flags [P.], seq 1421:2131, ack 1696, win 501, options [nop,nop,TS val 3771498406 ecr 4020374766], length 710: HTTP: HTTP/1.1 404 Not Found
06:03:28.239809 eth0  In  ifindex 3 5e:bd:24:92:01:4b ethertype IPv4 (0x0800), length 637: 10.244.0.96.44918 > 10.244.0.98.80: Flags [P.], seq 2347:2912, ack 2841, win 501, options [nop,nop,TS val 4020374766 ecr 3771498398], length 565: HTTP: GET /_next/static/chunks/2807-18d7cf2855f2197f.js HTTP/1.1
06:03:28.239846 eth0  Out ifindex 3 ee:4c:a8:85:69:d5 ethertype IPv4 (0x0800), length 782: 10.244.0.98.80 > 10.244.0.96.44936: Flags [P.], seq 4261:4971, ack 3960, win 501, options [nop,nop,TS val 3771498406 ecr 4020374766], length 710: HTTP: HTTP/1.1 404 Not Found
06:03:28.239893 eth0  Out ifindex 3 ee:4c:a8:85:69:d5 ethertype IPv4 (0x0800), length 782: 10.244.0.98.80 > 10.244.0.96.44918: Flags [P.], seq 2841:3551, ack 2912, win 501, options [nop,nop,TS val 3771498406 ecr 4020374766], length 710: HTTP: HTTP/1.1 404 Not Found
06:03:28.242574 eth0  In  ifindex 3 5e:bd:24:92:01:4b ethertype IPv4 (0x0800), length 637: 10.244.0.96.44918 > 10.244.0.98.80: Flags [P.], seq 2912:3477, ack 3551, win 501, options [nop,nop,TS val 4020374769 ecr 3771498406], length 565: HTTP: GET /_next/static/chunks/2827-6f446a80d17d0aa8.js HTTP/1.1
06:03:28.242631 eth0  Out ifindex 3 ee:4c:a8:85:69:d5 ethertype IPv4 (0x0800), length 782: 10.244.0.98.80 > 10.244.0.96.44918: Flags [P.], seq 3551:4261, ack 3477, win 501, options [nop,nop,TS val 3771498409 ecr 4020374769], length 710: HTTP: HTTP/1.1 404 Not Found
06:03:28.242999 eth0  In  ifindex 3 5e:bd:24:92:01:4b ethertype IPv4 (0x0800), length 636: 10.244.0.96.44918 > 10.244.0.98.80: Flags [P.], seq 3477:4041, ack 4261, win 501, options [nop,nop,TS val 4020374769 ecr 3771498409], length 564: HTTP: GET /_next/static/chunks/883-7019d4efebc36265.js HTTP/1.1
06:03:28.243051 eth0  Out ifindex 3 ee:4c:a8:85:69:d5 ethertype IPv4 (0x0800), length 782: 10.244.0.98.80 > 10.244.0.96.44918: Flags [P.], seq 4261:4971, ack 4041, win 501, options [nop,nop,TS val 3771498409 ecr 4020374769], length 710: HTTP: HTTP/1.1 404 Not Found
06:03:28.243195 eth0  In  ifindex 3 5e:bd:24:92:01:4b ethertype IPv4 (0x0800), length 636: 10.244.0.96.44950 > 10.244.0.98.80: Flags [P.], seq 1696:2260, ack 2131, win 501, options [nop,nop,TS val 4020374769 ecr 3771498406], length 564: HTTP: GET /_next/static/chunks/710-0cfca82eedaae5b3.js HTTP/1.1
06:03:28.243381 eth0  Out ifindex 3 ee:4c:a8:85:69:d5 ethertype IPv4 (0x0800), length 782: 10.244.0.98.80 > 10.244.0.96.44950: Flags [P.], seq 2131:2841, ack 2260, win 501, options [nop,nop,TS val 3771498409 ecr 4020374769], length 710: HTTP: HTTP/1.1 404 Not Found
06:03:28.243523 eth0  In  ifindex 3 5e:bd:24:92:01:4b ethertype IPv4 (0x0800), length 652: 10.244.0.96.44904 > 10.244.0.98.80: Flags [P.], seq 4237:4817, ack 4444, win 501, options [nop,nop,TS val 4020374770 ecr 3771498406], length 580: HTTP: GET /_next/static/chunks/app/redesign/layout-cd6491fd461e24e1.js HTTP/1.1
06:03:28.243570 eth0  In  ifindex 3 5e:bd:24:92:01:4b ethertype IPv4 (0x0800), length 637: 10.244.0.96.44924 > 10.244.0.98.80: Flags [P.], seq 3391:3956, ack 4261, win 501, options [nop,nop,TS val 4020374770 ecr 3771498406], length 565: HTTP: GET /_next/static/chunks/8046-c25f0938404aba7e.js HTTP/1.1
06:03:28.243602 eth0  Out ifindex 3 ee:4c:a8:85:69:d5 ethertype IPv4 (0x0800), length 782: 10.244.0.98.80 > 10.244.0.96.44904: Flags [P.], seq 4444:5154, ack 4817, win 501, options [nop,nop,TS val 3771498410 ecr 4020374770], length 710: HTTP: HTTP/1.1 404 Not Found
06:03:28.243617 eth0  In  ifindex 3 5e:bd:24:92:01:4b ethertype IPv4 (0x0800), length 637: 10.244.0.96.44920 > 10.244.0.98.80: Flags [P.], seq 2855:3420, ack 3551, win 501, options [nop,nop,TS val 4020374770 ecr 3771498405], length 565: HTTP: GET /_next/static/chunks/4442-254da681b2d19715.js HTTP/1.1
06:03:28.243672 eth0  Out ifindex 3 ee:4c:a8:85:69:d5 ethertype IPv4 (0x0800), length 782: 10.244.0.98.80 > 10.244.0.96.44924: Flags [P.], seq 4261:4971, ack 3956, win 501, options [nop,nop,TS val 3771498410 ecr 4020374770], length 710: HTTP: HTTP/1.1 404 Not Found
06:03:28.243710 eth0  Out ifindex 3 ee:4c:a8:85:69:d5 ethertype IPv4 (0x0800), length 782: 10.244.0.98.80 > 10.244.0.96.44920: Flags [P.], seq 3551:4261, ack 3420, win 501, options [nop,nop,TS val 3771498410 ecr 4020374770], length 710: HTTP: HTTP/1.1 404 Not Found
06:03:28.244426 eth0  In  ifindex 3 5e:bd:24:92:01:4b ethertype IPv4 (0x0800), length 643: 10.244.0.96.44918 > 10.244.0.98.80: Flags [P.], seq 4041:4612, ack 4971, win 501, options [nop,nop,TS val 4020374771 ecr 3771498409], length 571: HTTP: GET /_next/static/chunks/app/layout-4bea45c5c9f1ff3d.js HTTP/1.1
06:03:28.244506 eth0  Out ifindex 3 ee:4c:a8:85:69:d5 ethertype IPv4 (0x0800), length 782: 10.244.0.98.80 > 10.244.0.96.44918: Flags [P.], seq 4971:5681, ack 4612, win 501, options [nop,nop,TS val 3771498411 ecr 4020374771], length 710: HTTP: HTTP/1.1 404 Not Found
06:03:28.245698 eth0  In  ifindex 3 5e:bd:24:92:01:4b ethertype IPv4 (0x0800), length 642: 10.244.0.96.44920 > 10.244.0.98.80: Flags [P.], seq 3420:3990, ack 4261, win 501, options [nop,nop,TS val 4020374772 ecr 3771498410], length 570: HTTP: GET /_next/static/chunks/app/error-fcfe816c8de65594.js HTTP/1.1
06:03:28.245744 eth0  Out ifindex 3 ee:4c:a8:85:69:d5 ethertype IPv4 (0x0800), length 782: 10.244.0.98.80 > 10.244.0.96.44920: Flags [P.], seq 4261:4971, ack 3990, win 501, options [nop,nop,TS val 3771498412 ecr 4020374772], length 710: HTTP: HTTP/1.1 404 Not Found
06:03:28.246519 eth0  In  ifindex 3 5e:bd:24:92:01:4b ethertype IPv4 (0x0800), length 646: 10.244.0.96.44920 > 10.244.0.98.80: Flags [P.], seq 3990:4564, ack 4971, win 501, options [nop,nop,TS val 4020374773 ecr 3771498412], length 574: HTTP: GET /_next/static/chunks/app/not-found-b5a97e8a6cf8fd18.js HTTP/1.1
06:03:28.246572 eth0  Out ifindex 3 ee:4c:a8:85:69:d5 ethertype IPv4 (0x0800), length 782: 10.244.0.98.80 > 10.244.0.96.44920: Flags [P.], seq 4971:5681, ack 4564, win 501, options [nop,nop,TS val 3771498413 ecr 4020374773], length 710: HTTP: HTTP/1.1 404 Not Found
06:03:28.250093 eth0  In  ifindex 3 5e:bd:24:92:01:4b ethertype IPv4 (0x0800), length 637: 10.244.0.96.44950 > 10.244.0.98.80: Flags [P.], seq 2260:2825, ack 2841, win 501, options [nop,nop,TS val 4020374776 ecr 3771498409], length 565: HTTP: GET /_next/static/chunks/4076-cc2956bbb3a181e1.js HTTP/1.1
06:03:28.250933 eth0  Out ifindex 3 ee:4c:a8:85:69:d5 ethertype IPv4 (0x0800), length 782: 10.244.0.98.80 > 10.244.0.96.44950: Flags [P.], seq 2841:3551, ack 2825, win 501, options [nop,nop,TS val 3771498417 ecr 4020374776], length 710: HTTP: HTTP/1.1 404 Not Found
06:03:28.251162 eth0  In  ifindex 3 5e:bd:24:92:01:4b ethertype IPv4 (0x0800), length 637: 10.244.0.96.44918 > 10.244.0.98.80: Flags [P.], seq 4612:5177, ack 5681, win 501, options [nop,nop,TS val 4020374777 ecr 3771498411], length 565: HTTP: GET /_next/static/chunks/5219-344a1985ba8fd2c5.js HTTP/1.1
06:03:28.251373 eth0  Out ifindex 3 ee:4c:a8:85:69:d5 ethertype IPv4 (0x0800), length 782: 10.244.0.98.80 > 10.244.0.96.44918: Flags [P.], seq 5681:6391, ack 5177, win 501, options [nop,nop,TS val 3771498417 ecr 4020374777], length 710: HTTP: HTTP/1.1 404 Not Found
06:03:28.251450 eth0  In  ifindex 3 5e:bd:24:92:01:4b ethertype IPv4 (0x0800), length 637: 10.244.0.96.44920 > 10.244.0.98.80: Flags [P.], seq 4564:5129, ack 5681, win 501, options [nop,nop,TS val 4020374778 ecr 3771498413], length 565: HTTP: GET /_next/static/chunks/1213-d6386b35782bd475.js HTTP/1.1
06:03:28.251590 eth0  In  ifindex 3 5e:bd:24:92:01:4b ethertype IPv4 (0x0800), length 637: 10.244.0.96.44924 > 10.244.0.98.80: Flags [P.], seq 3956:4521, ack 4971, win 501, options [nop,nop,TS val 4020374778 ecr 3771498410], length 565: HTTP: GET /_next/static/chunks/6297-028a473c16543718.js HTTP/1.1
06:03:28.252521 eth0  Out ifindex 3 ee:4c:a8:85:69:d5 ethertype IPv4 (0x0800), length 782: 10.244.0.98.80 > 10.244.0.96.44920: Flags [P.], seq 5681:6391, ack 5129, win 501, options [nop,nop,TS val 3771498419 ecr 4020374778], length 710: HTTP: HTTP/1.1 404 Not Found
06:03:28.254660 eth0  In  ifindex 3 5e:bd:24:92:01:4b ethertype IPv4 (0x0800), length 637: 10.244.0.96.44904 > 10.244.0.98.80: Flags [P.], seq 4817:5382, ack 5154, win 501, options [nop,nop,TS val 4020374776 ecr 3771498410], length 565: HTTP: GET /_next/static/chunks/5803-ad73e1f96b7ff3af.js HTTP/1.1
06:03:28.254851 eth0  Out ifindex 3 ee:4c:a8:85:69:d5 ethertype IPv4 (0x0800), length 782: 10.244.0.98.80 > 10.244.0.96.44924: Flags [P.], seq 4971:5681, ack 4521, win 501, options [nop,nop,TS val 3771498421 ecr 4020374778], length 710: HTTP: HTTP/1.1 404 Not Found
06:03:28.254873 eth0  Out ifindex 3 ee:4c:a8:85:69:d5 ethertype IPv4 (0x0800), length 782: 10.244.0.98.80 > 10.244.0.96.44904: Flags [P.], seq 5154:5864, ack 5382, win 501, options [nop,nop,TS val 3771498421 ecr 4020374776], length 710: HTTP: HTTP/1.1 404 Not Found
06:03:28.255227 eth0  In  ifindex 3 5e:bd:24:92:01:4b ethertype IPv4 (0x0800), length 650: 10.244.0.96.44936 > 10.244.0.98.80: Flags [P.], seq 3960:4538, ack 4971, win 501, options [nop,nop,TS val 4020374781 ecr 3771498406], length 578: HTTP: GET /_next/static/chunks/app/redesign/page-eff202d726167cf6.js HTTP/1.1
06:03:28.258889 eth0  Out ifindex 3 ee:4c:a8:85:69:d5 ethertype IPv4 (0x0800), length 782: 10.244.0.98.80 > 10.244.0.96.44936: Flags [P.], seq 4971:5681, ack 4538, win 501, options [nop,nop,TS val 3771498425 ecr 4020374781], length 710: HTTP: HTTP/1.1 404 Not Found
06:03:28.259548 eth0  In  ifindex 3 5e:bd:24:92:01:4b ethertype IPv4 (0x0800), length 725: 10.244.0.96.44924 > 10.244.0.98.80: Flags [P.], seq 4521:5174, ack 5681, win 501, options [nop,nop,TS val 4020374786 ecr 3771498421], length 653: HTTP: GET /_next/static/images/img/owl-flight-5d7d1106ce62f5dd4057eb334384e529.gif HTTP/1.1
06:03:28.259568 eth0  In  ifindex 3 5e:bd:24:92:01:4b ethertype IPv4 (0x0800), length 662: 10.244.0.96.44950 > 10.244.0.98.80: Flags [P.], seq 2825:3415, ack 3551, win 501, options [nop,nop,TS val 4020374786 ecr 3771498417], length 590: HTTP: GET /skeleton HTTP/1.1
06:03:28.259580 eth0  In  ifindex 3 5e:bd:24:92:01:4b ethertype IPv4 (0x0800), length 718: 10.244.0.96.44904 > 10.244.0.98.80: Flags [P.], seq 5382:6028, ack 5864, win 501, options [nop,nop,TS val 4020374786 ecr 3771498421], length 646: HTTP: GET /_next/static/images/img/img-cd489e58b05164eea078d88ec290a972.png HTTP/1.1
06:03:28.259622 eth0  In  ifindex 3 5e:bd:24:92:01:4b ethertype IPv4 (0x0800), length 718: 10.244.0.96.44936 > 10.244.0.98.80: Flags [P.], seq 4538:5184, ack 5681, win 501, options [nop,nop,TS val 4020374786 ecr 3771498425], length 646: HTTP: GET /_next/static/images/img/img-d3a4f754f58ac0ddefd43c3f05b5e068.png HTTP/1.1
06:03:28.259641 eth0  In  ifindex 3 5e:bd:24:92:01:4b ethertype IPv4 (0x0800), length 732: 10.244.0.96.44920 > 10.244.0.98.80: Flags [P.], seq 5129:5789, ack 6391, win 501, options [nop,nop,TS val 4020374786 ecr 3771498419], length 660: HTTP: GET /_next/static/images/img/defaultCourseIcon-61a8d15c5cf91970fc841b89b4f3a869.svg HTTP/1.1
06:03:28.259653 eth0  Out ifindex 3 ee:4c:a8:85:69:d5 ethertype IPv4 (0x0800), length 782: 10.244.0.98.80 > 10.244.0.96.44924: Flags [P.], seq 5681:6391, ack 5174, win 501, options [nop,nop,TS val 3771498426 ecr 4020374786], length 710: HTTP: HTTP/1.1 404 Not Found
06:03:28.259712 eth0  Out ifindex 3 ee:4c:a8:85:69:d5 ethertype IPv4 (0x0800), length 782: 10.244.0.98.80 > 10.244.0.96.44950: Flags [P.], seq 3551:4261, ack 3415, win 501, options [nop,nop,TS val 3771498426 ecr 4020374786], length 710: HTTP: HTTP/1.1 404 Not Found
06:03:28.259743 eth0  Out ifindex 3 ee:4c:a8:85:69:d5 ethertype IPv4 (0x0800), length 782: 10.244.0.98.80 > 10.244.0.96.44904: Flags [P.], seq 5864:6574, ack 6028, win 501, options [nop,nop,TS val 3771498426 ecr 4020374786], length 710: HTTP: HTTP/1.1 404 Not Found
06:03:28.259764 eth0  Out ifindex 3 ee:4c:a8:85:69:d5 ethertype IPv4 (0x0800), length 782: 10.244.0.98.80 > 10.244.0.96.44936: Flags [P.], seq 5681:6391, ack 5184, win 501, options [nop,nop,TS val 3771498426 ecr 4020374786], length 710: HTTP: HTTP/1.1 404 Not Found
06:03:28.259843 eth0  Out ifindex 3 ee:4c:a8:85:69:d5 ethertype IPv4 (0x0800), length 782: 10.244.0.98.80 > 10.244.0.96.44920: Flags [P.], seq 6391:7101, ack 5789, win 501, options [nop,nop,TS val 3771498426 ecr 4020374786], length 710: HTTP: HTTP/1.1 404 Not Found
06:03:28.261441 eth0  In  ifindex 3 5e:bd:24:92:01:4b ethertype IPv4 (0x0800), length 725: 10.244.0.96.44936 > 10.244.0.98.80: Flags [P.], seq 5184:5837, ack 6391, win 501, options [nop,nop,TS val 4020374788 ecr 3771498426], length 653: HTTP: GET /_next/static/images/img/footerUivk-1a499178c819de0f4161a07172b27f6b.svg HTTP/1.1
06:03:28.261497 eth0  Out ifindex 3 ee:4c:a8:85:69:d5 ethertype IPv4 (0x0800), length 782: 10.244.0.98.80 > 10.244.0.96.44936: Flags [P.], seq 6391:7101, ack 5837, win 501, options [nop,nop,TS val 3771498428 ecr 4020374788], length 710: HTTP: HTTP/1.1 404 Not Found
06:03:28.261869 eth0  In  ifindex 3 5e:bd:24:92:01:4b ethertype IPv4 (0x0800), length 725: 10.244.0.96.44920 > 10.244.0.98.80: Flags [P.], seq 5789:6442, ack 7101, win 501, options [nop,nop,TS val 4020374788 ecr 3771498426], length 653: HTTP: GET /_next/static/images/img/footerUiyt-84e5fa7c2e582191762486a7be2c2652.svg HTTP/1.1
06:03:28.261919 eth0  Out ifindex 3 ee:4c:a8:85:69:d5 ethertype IPv4 (0x0800), length 782: 10.244.0.98.80 > 10.244.0.96.44920: Flags [P.], seq 7101:7811, ack 6442, win 501, options [nop,nop,TS val 3771498428 ecr 4020374788], length 710: HTTP: HTTP/1.1 404 Not Found
06:03:28.262084 eth0  In  ifindex 3 5e:bd:24:92:01:4b ethertype IPv4 (0x0800), length 727: 10.244.0.96.44904 > 10.244.0.98.80: Flags [P.], seq 6028:6683, ack 6574, win 501, options [nop,nop,TS val 4020374788 ecr 3771498426], length 655: HTTP: GET /_next/static/images/img/footerUidzen-cfe01a671b9064c8e5d54b2ac5895a0c.png HTTP/1.1
